METAI;PIRK_PLANO_NR;PADALINIO_KODAS;EIL_NR;TIPAS;KATEG_KODAS;BVPZ_KODAS;PERK_OBJEKTAS;AV_KODAS;APRASYMAS;PADALINIO_KODAS;TRUKMES_KODAS;ZALIASIS_PIRKIM_FLAG;CENTR_PIRKIM_FLAG;ELEKTRON_PIRKIM_FLAG;PIRKIM_REZERV_TEISE_FLAG;PIRKIMO_BUDAS;PRADZIOS_KODAS;BUSENA;LYDR_ID;PU_NUMERIS;SUTARTIES_REGISTR_NUMERIS;SUTARTIES_SUDARYMO_DATA;SUDARYTOS_SUTARTIES_SUMA
2023;"ES 23";1020930;11;Paslaugos;507;50700000-2;"Inžinerinių sistemų ir statinių techninės priežiūros ir remonto paslaugos Vilniaus miesto ikimokyklinio ugdymo įstaigose (darželiuose) bei švietimo įstaigose (mokyklose) A ir B zona";188710061;;3;N;N;Y;N;"Atviras konkursas";II;Patvirtinta;;;;;
2023;ITG2023;1021130;46;Paslaugos;642;64200000-8;"Fiksuoto ryšio paslaugos";188710061;;3;N;N;N;N;"Atviras konkursas";II;Patvirtinta;;;;;
2023;SIS2023;1090100;34;Paslaugos;642;64200000-8;"Telefonijos paslaugos";188710061;"2023 metų pirkimų planas";1;N;N;N;N;"Mažos vertės pirkimai";IV;Patvirtinta;;;;;
2023;SEN13-2023;1012000;5;Paslaugos;923;92300000-4;"Kalėdinės šventės organizavimas";188710061;;1;N;N;N;N;"Mažos vertės pirkimai";IV;Patvirtinta;;;;;
2023;ITG2023;1021130;9;Prekės;302;30233000-1;"Duomenų saugyklos diskai";188710061;;1;N;N;N;N;"Atviras konkursas";III;Patvirtinta;;;;;
2023;ŠAS2023;1021070;23;Paslaugos;712;71220000-6;"Mokslo paskirties pastato (gimnazijos), M. Marcinkevičiaus g. 72, Vilniuje, architektūrinio atviro projekto konkursas";188710061;;2;Y;N;Y;N;"Atviras konkursas";I;Patvirtinta;;;;;
2023;S18-2023;1012400;7;Prekės;374;37410000-5;"Lauko treniruokliai, jų įrengimas Rugių g. ir Žaliųjų Ežerų g.";188710061;;1;N;N;N;N;"Mažos vertės pirkimai";II;Patvirtinta;;;;;
2023;1;10106000;35;Paslaugos;553;55320000-9;"Maitinimo paslaugų organizavimas";188710061;;1;N;N;N;N;"Mažos vertės pirkimai";I;Patvirtinta;;;;;
2023;1;10106000;45;Paslaugos;794;79410000-1;"Iniciatyvos „Neakivaizdinis Vilnius“ administravimo, komunikacijos ir turinio kūrimo paslaugos";188710061;;1;N;N;N;N;"Mažos vertės pirkimai";I;Patvirtinta;;;;;
2023;1;10106000;7;Prekės;392;39221121-1;"Puodeliai su Vilniaus ženklu";188710061;;1;N;N;N;N;"Mažos vertės pirkimai";II;Patvirtinta;;;;;
2023;ITG2023;1021130;33;Paslaugos;723;72300000-8;"Teisinės informacinės sistemos paieškos paslaugos";188710061;;3;N;N;N;N;"Atviras konkursas";IV;Patvirtinta;;;;;
2023;AP-23;10200;34;Prekės;301;30190000-7;"Įvairi biuro įranga ir reikmenys";188710061;;1;N;N;N;N;"Mažos vertės pirkimai";I;Patvirtinta;;;;;
2023;AP-23;10200;54;Prekės;341;34110000-1;"Automobilių nuoma";188710061;;1;N;N;N;N;"Mažos vertės pirkimai";II;Patvirtinta;;;;;
2023;INF-2023;1020960;23;Darbai;Darbai;45240000-1;"Vilniaus miesto fontanų remontas";188710061;"2023 m. Infrastruktūros skyriaus pirkimų planas";1;Y;N;Y;N;"Atviras konkursas (supaprastintas pirkimas)";III;Patvirtinta;;;;;
2023;"Žirmūnų sen.- 2023";1012700;7;Paslaugos;799;79952000-2;"Žirmūnų seniūnijos renginių organizavimas";188710061;;1;N;N;N;N;"Mažos vertės pirkimai";I;Patvirtinta;;;;;
2023;SIS2023;1090100;35;Paslaugos;508;50800000-3;"Įvairios remonto paslaugos.";188710061;"2023 metų pirkimų planas";1;N;N;N;N;"Mažos vertės pirkimai";II;Patvirtinta;;;;;
2023;SEN1-2023;1010800;5;Darbai;Darbai;45236290-9;"Antakalnio seniūnijos projekto „Dalyvauk“ rekreacinių zonų atnaujinimas Viršupio sodų g";188710061;;1;N;N;N;N;"Mažos vertės pirkimai";II;Patvirtinta;;;;;
2023;ITG2023;1021130;5;Prekės;488;48820000-2;"Tarnybinių stočių komponentai ir atsarginės dalys";188710061;;1;N;N;N;N;"Mažos vertės pirkimai";II;Patvirtinta;;;;;
2023;"EOS 23";1017100;17;Prekės;349;34971000-4;"Vidutinio greičio matavimo sistem (toliau - VGMS) įrengimas";188710061;;3;N;N;Y;N;"Atviras konkursas";I;Patvirtinta;;;;;
2023;S10-2023;1011700;8;Paslaugos;923;92300000-4;"Kalėdinės eglės įžiebimo šventės paslaugos";188710061;;1;N;N;N;N;"Mažos vertės pirkimai";III;Patvirtinta;;;;;
2023;1;10106000;84;Paslaugos;795;79530000-8;"Neakivaizdinio Vilniaus turinio vertimo į anglų kalbą paslaugos";188710061;;1;N;N;N;N;"Mažos vertės pirkimai";I;Patvirtinta;;;;;
2023;AP-23;10200;113;Prekės;391;39130000-2;"Biuro baldai";188710061;;1;N;N;N;N;"Atviras konkursas";I;Patvirtinta;;;;;
2023;1;10106000;43;Paslaugos;793;79341000-6;"Informacijos apie Vilniaus miesto turizmo galimybes skleidimas socialiniuose tinkluose, internete";188710061;;1;N;N;N;N;"Mažos vertės pirkimai";III;Patvirtinta;;;;;
2023;1;1010203;4;Paslaugos;794;79421000-1;"Konsultacinių paslaugų Vilniaus miesto savivaldybės administracijos įgyvendinamiems projektams pirkimas";188710061;"2023 m. pirkimų planas";1;N;N;N;N;"Atviras konkursas";IV;Patvirtinta;;;;;
2023;SIS2023;1090100;38;Paslaugos;753;75310000-2;"Socialinių kortelių pagaminimas, jų išdavimas, administravimas, socialinių išmokų pervedimas į jas ir prekių išdavimas.";188710061;"2023 metų pirkimų planas";3;N;N;Y;N;"Atviras konkursas";II;Patvirtinta;;;;;
2023;"ES 23";1020930;16;Darbai;Darbai;45332000-3;"Vandentiekio ir nuotekų tinklų plėtra Vilniaus mieste";188710061;;2;Y;N;N;N;"Atviras konkursas (supaprastintas pirkimas)";I;Patvirtinta;;;;;
2023;VŠT2023;16400;9;Prekės;444;44424300-1;Atšvaitai;188710061;"Viešosios tvarkos skyrius";1;N;N;N;N;"Mažos vertės pirkimai";II;Patvirtinta;;;;;
2023;S17-2023;1012500;3;Darbai;Darbai;45236290-9;"Laiptų ir turėklų remonto darbai";188710061;;1;N;N;N;N;"Mažos vertės pirkimai";II;Patvirtinta;;;;;
2023;ITG2023;1021130;40;Paslaugos;722;72261000-2;"Automatizuotos fotogrametrijos ir paviršiaus duomenų apdorojimo programinės įrangos techninis palaikymas";188710061;;1;N;N;N;N;"Mažos vertės pirkimai";II;Patvirtinta;;;;;
2023;1;1020850;6;Prekės;442;44212320-8;"Stacionarių archyvinių stelažų įsigijimas";188710061;;1;N;N;N;N;"Mažos vertės pirkimai";II;Patvirtinta;;;;;
2023;SIS2023;1090100;37;Prekės;302;30200000-1;"IS ""Parama"" tarnybinės stoties praplėtimas (iki 128 Gb Ram, 4 TB)";188710061;"2023 metų pirkimų planas";1;N;N;N;N;"Mažos vertės pirkimai";III;Patvirtinta;;;;;
2023;1;10106000;74;Paslaugos;923;92310000-7;"Kūrybinio turinio sukūrimas Vilniaus pristatymui tarptautinėje turizmo parodoje „Adventur“";188710061;;1;N;N;N;N;"Mažos vertės pirkimai";IV;Patvirtinta;;;;;
2023;VŠT2023;16400;10;Prekės;185;18530000-3;"Suvenyrai prevencinių priemonių dalyviams";188710061;"Viešosios tvarkos skyrius";1;N;N;N;N;"Mažos vertės pirkimai";I;Patvirtinta;;;;;
2023;AP-23;10200;23;Prekės;391;39150000-8;"Įvairūs baldai bei įranga (Rasų seniūnija)";188710061;;1;N;N;Y;N;"Atviras konkursas";I;Patvirtinta;;;;;
2023;RKS2023;1400300;5;Paslaugos;793;79320000-3;"Reprezentatyvi Vilniaus miesto gyventojų nuomonės apklausa ir tyrimas";188710061;"2023 metų pirkimų planas";1;N;N;N;N;"Atviras konkursas";III;Patvirtinta;;;;;
2023;S10-2023;1011700;2;Darbai;Darbai;45236119-7;"Sporto aikštelių remonto ir įrengimo  darbai.";188710061;;1;N;N;N;N;"Mažos vertės pirkimai";II;Patvirtinta;;;;;
2023;AP-23;10200;77;Paslaugos;723;72316000-3;"Darbų saugos mokomosios sistemos įsigijimas";188710061;;1;N;N;N;N;"Mažos vertės pirkimai";I;Patvirtinta;;;;;
2023;SEN13-2023;1012000;4;Paslaugos;923;92300000-4;"Rasų šventės organizavimas";188710061;;1;N;N;N;N;"Mažos vertės pirkimai";II;Patvirtinta;;;;;
2023;1;10106000;12;Prekės;228;22815000-6;"Užrašinės su Vilniaus ženklu";188710061;;1;N;N;N;N;"Mažos vertės pirkimai";III;Patvirtinta;;;;;
2023;CIV-1;16100;9;Prekės;424;42416300-8;Keltuvai;188710061;;1;N;N;N;N;"Mažos vertės pirkimai";I;Patvirtinta;;;;;
2023;INF-2023;1020960;32;Darbai;Darbai;45231400-9;"110 kV įtampos oro linijos Šiaurinė-Šeškinė I, II ir Šeškinė-Žvėrynas I, II Vilniaus mieste rekonstravimas";188710061;"2023 m. Infrastruktūros skyriaus pirkimų planas";2;Y;N;Y;N;"Atviras konkursas (supaprastintas pirkimas)";III;Patvirtinta;;;;;
2023;AP-23;10200;61;Paslaugos;851;85100000-0;"Privalomieji darbuotojų sveikatos tikrinimai";188710061;;3;N;N;N;N;"Mažos vertės pirkimai";I;Patvirtinta;;;;;
2023;"Žirmūnų sen.- 2023";1012700;4;Darbai;Darbai;45112720-8;"Erdvė stalo tenisui";188710061;;1;N;N;N;N;"Mažos vertės pirkimai";II;Patvirtinta;;;;;
2023;AP-23;10200;76;Darbai;Darbai;45259000-7;"Neįgaliųjų keltuvo priežiūros ir aptarnavimo darbai";188710061;;3;N;N;N;N;"Mažos vertės pirkimai";I;Patvirtinta;;;;;
2023;ITG2023;1021130;21;Prekės;487;48761000-0;"Galinio taško aptikimo ir atsako (EDR) papildomos licencijos";188710061;;3;N;N;N;N;"Atviras konkursas (supaprastintas pirkimas)";II;Patvirtinta;;;;;
2023;1;10106000;10;Prekės;189;18930000-7;"Medžiaginiai maišeliai su Vilniaus ženklu";188710061;;1;N;N;N;N;"Mažos vertės pirkimai";II;Patvirtinta;;;;;
2023;SPO-23;1021050;4;Paslaugos;731;73120000-9;"Kūno kultūros ir sporto rėmimo programų konkurso paraiškų vertinimo konsultacinės ekspertų paslaugos";188710061;;1;N;N;N;N;"Mažos vertės pirkimai";IV;Patvirtinta;;;;;
2023;"MTAAS 23";1021020;15;Darbai;Darbai;45215500-2;"Viešojo kanalizuoto automatinio tualeto M. K. Čiurlionio g. 100 įrengimas";188710061;;1;Y;N;Y;N;"Atviras konkursas (supaprastintas pirkimas)";I;Patvirtinta;;;;;
2023;INF-2023;1020960;17;Darbai;Darbai;45313000-4;"Liftų, keltuvų požeminėse perėjose įrengimas";188710061;"2023 m. Infrastruktūros skyriaus pirkimų planas";2;N;N;Y;N;"Atviras konkursas (supaprastintas pirkimas)";II;Patvirtinta;;;;;
2023;SPO-23;1021050;2;Prekės;374;37451700-1;"Futbolo kamuoliai";188710061;;1;N;N;N;N;"Mažos vertės pirkimai";II;Patvirtinta;;;;;
2023;1;10106000;19;Prekės;395;39525000-8;"Pledai su Vilniaus ženklu";188710061;;1;N;N;N;N;"Mažos vertės pirkimai";II;Patvirtinta;;;;;
2023;ŠAS2023;1021070;24;Paslaugos;713;71319000-7;"Mokslo paskirties pastato, Savanorių pr. 55, Vilniuje, darbo projekto konstrukcinės dalies ekspertizės paslaugos";188710061;;1;Y;Y;N;N;"Atviras konkursas";II;Patvirtinta;;;;;
2023;ŽIVS2023;1021120;10;Paslaugos;805;80580000-3;"Anglų kalbos  mokymai";188710061;;1;N;N;Y;N;"Atviras konkursas";I;Patvirtinta;;;;;
2023;AP-23;10200;56;Paslaugos;601;60100000-9;"Automobilių dalijimosi paslauga";188710061;;1;N;N;N;N;"Mažos vertės pirkimai";II;Patvirtinta;;;;;
2023;AP-23;10200;87;Paslaugos;773;77310000-6;"Gėlių priežiūra";188710061;;1;N;N;N;N;"Mažos vertės pirkimai";II;Patvirtinta;;;;;
2023;1;10106000;93;Prekės;444;44424300-1;"Atšvaitai su Vilniaus ženklu";188710061;;1;N;N;N;N;"Mažos vertės pirkimai";I;Patvirtinta;;;;;
2023;AP-23;10200;40;Paslaugos;665;66510000-8;"Valstybės tarnautojų ir darbuotojų dirbančių pagal darbo sutartį bei mero ir jo pavaduotojų atsakomybės  draudimas";188710061;;1;N;N;Y;N;"Atviras konkursas (supaprastintas pirkimas)";I;Patvirtinta;;;;;
2023;ŠAS2023;1021070;26;Paslaugos;713;71319000-7;"Mokslo paskirties pastato, Lukiškių skg. 5, Vilniuje, techninio projekto bendrosios projekto ekspertizės paslaugos";188710061;;1;Y;Y;N;N;"Atviras konkursas";II;Patvirtinta;;;;;
2023;ŠAS2023;1021070;31;Paslaugos;713;71319000-7;"Mokslo paskirties pastato, Blindžių g. 3, Vilniuje, techninio projekto specialiosios projekto ekspertizės paslaugos";188710061;;1;Y;N;N;N;"Mažos vertės pirkimai";III;Patvirtinta;;;;;
2023;RKS2023;1400300;3;Paslaugos;921;92111000-2;"Vilniaus pokyčių komunikacija video projekto paslaugos";188710061;"2023 metų pirkimų planas";1;N;N;N;N;"Atviras konkursas (supaprastintas pirkimas)";II;Patvirtinta;;;;;
2023;VŠT2023;16400;11;Prekės;189;18938000-3;"Vienkartiniai maišeliai gyvūnų ekskrementams rinkti";188710061;"Viešosios tvarkos skyrius";1;N;N;N;N;"Mažos vertės pirkimai";II;Patvirtinta;;;;;
2023;admin2023;16200;2;Darbai;Darbai;45255400-3;"Bešeimininkių kačių būdų gamyba (slėptuvės)";188710061;"Administracinės veiklos skyrius";1;N;N;N;N;"Mažos vertės pirkimai";II;Patvirtinta;;;;;
2023;1;10106000;87;Prekės;221;22114300-5;"Vilniaus miesto žemėlapiai";188710061;;1;N;N;N;N;"Mažos vertės pirkimai";I;Patvirtinta;;;;;
2023;"Žirmūnų sen.- 2023";1012700;1;Darbai;Darbai;45420000-7;"Žirmūnų seniūnijos rinkimų apylinkių inventoriaus montavimo ir remonto darbai";188710061;;1;N;N;N;N;"Mažos vertės pirkimai";I;Patvirtinta;;;;;
2023;SIS2023;1090100;5;Prekės;301;30192000-1;"Kanceliarinės prekės";188710061;"2023 metų pirkimų planas";1;N;Y;Y;N;"Atviras konkursas";III;Patvirtinta;;;;;
2023;RKS2023;1400300;8;Paslaugos;798;79822500-7;"Grafinio dizaino paslaugos";188710061;"2023 metų pirkimų planas";1;N;N;N;N;"Mažos vertės pirkimai";II;Patvirtinta;;;;;
2023;1;10106000;58;Paslaugos;799;79970000-4;"Gido „Savaitgalis Vilniuje“ parengimas ir leidyba";188710061;;1;N;N;N;N;"Atviras konkursas";I;Patvirtinta;;;;;
2023;SIS2023;1090100;24;Paslaugos;507;50750000-7;"Lifto priežiūros ir remonto paslaugos";188710061;"2023 metų pirkimų planas";1;N;N;N;N;"Mažos vertės pirkimai";I;Patvirtinta;;;;;
2023;1;1011300;6;Darbai;Darbai;45453100-8;"Seniūnijos vidaus patalpų remontas";188710061;;1;N;N;N;N;"Mažos vertės pirkimai";II;Patvirtinta;;;;;
2023;ITG2023;1021130;44;Paslaugos;796;79620000-6;"IT žmogiškųjų išteklių nuoma (PowerBI)";188710061;;3;N;N;N;N;"Atviras konkursas (supaprastintas pirkimas)";I;Patvirtinta;;;;;
2023;"ES 23";1020930;14;Darbai;Darbai;45332000-3;"Vilniaus miesto savivaldybės administracijos valdomų ir bešeimininkių vandentiekio ir nuotekų šalinimo tinklų rekonstravimo ir (ar) remonto darbai";188710061;;1;Y;N;Y;N;"Atviras konkursas (supaprastintas pirkimas)";I;Patvirtinta;;;;;
2023;AP-23;10200;86;Prekės;445;44510000-8;"Rankiniai ir elektriniai įrankiai";188710061;;1;N;N;N;N;"Mažos vertės pirkimai";I;Patvirtinta;;;;;
2023;SIS2023;1090100;15;Paslaugos;503;50300000-8;-;188710061;"2023 metų pirkimų planas";1;N;N;N;N;"Mažos vertės pirkimai";I;Patvirtinta;;;;;
2023;SPO-23;1021050;1;Prekės;374;37452200-3;"Krepšinio kamuoliai";188710061;;1;N;N;N;N;"Mažos vertės pirkimai";II;Patvirtinta;;;;;
2023;ADV-2023;1021110;1;Paslaugos;713;71354300-7;"Žemės sklypų kadastriniai matavimai";188710061;;1;Y;N;N;N;"Atviras konkursas";I;Patvirtinta;;;;;
2023;ŽIVS2023;1021120;8;Paslaugos;805;80511000-9;"Seniūnijų veiklos mokymai";188710061;;1;N;N;N;N;"Mažos vertės pirkimai";I;Patvirtinta;;;;;
2023;SIS2023;1090100;7;Prekės;322;32250000-0;"Mobilieji telefonai";188710061;"2023 metų pirkimų planas";1;N;N;N;N;"Mažos vertės pirkimai";I;Patvirtinta;;;;;
2023;AP-23;10200;66;Darbai;Darbai;45315600-4;"Priešgaisrinės audio sistemos kabeliavimo ir garsiakalbių atnaujinimo darbai";188710061;;1;N;N;N;N;"Mažos vertės pirkimai";I;Patvirtinta;;;;;
2023;SPS-2023;1021040;4;Paslaugos;731;73110000-6;"Vilniaus (Kirtimų) romų taboro bendruomenės integracijos į visuomenę 2016–2019 m. ir Vilniaus romų integracijos į visuomenę 2020–2023 m. programų socialinės integracijos efektyvumo stebėsenos ir vertinimo tyrimas";188710061;;1;N;N;N;N;"Mažos vertės pirkimai";II;Patvirtinta;;;;;
2023;1;1011800;5;Darbai;Darbai;45236100-1;"Projekto  „Dalyvauk! Vilnius“ Tarandės lauko sporto aikštelės dangos įrengimo darbai";188710061;"Pašilaičių seniūnijos 2023 m. pirkimų planas";1;N;N;N;N;"Mažos vertės pirkimai";II;Patvirtinta;;;;;
2023;KAS-2023;1021150;5;Paslaugos;716;71630000-3;"Vilniaus senųjų Rasų kapinėse stichijos sužalotų kapaviečių tvarkybos darbų aprašų ir darbų sąmatų parengimas";188710061;;1;Y;N;N;N;"Mažos vertės pirkimai";II;Patvirtinta;;;;;
2023;AP-23;10200;91;Prekės;397;39710000-2;"Protokoliniams renginiams skirtų įrenginių nuoma";188710061;;1;N;N;N;N;"Mažos vertės pirkimai";IV;Patvirtinta;;;;;
2023;1;1011500;8;Darbai;Darbai;45212221-1;"Sporto aikštelės įrengimas (Dalyvauk)";188710061;;1;N;N;N;N;"Mažos vertės pirkimai";II;Patvirtinta;;;;;
2023;ŽS2023;1012800;3;Darbai;Darbai;45420000-7;"Rinkimų apylinkių inventoriaus montavimo ir remonto darbai";188710061;;1;N;N;N;N;"Mažos vertės pirkimai";I;Patvirtinta;;;;;
2023;1;10106000;59;Paslaugos;798;79810000-5;"Spausdinimo paslaugos";188710061;;1;N;N;N;N;"Mažos vertės pirkimai";I;Patvirtinta;;;;;
2023;S12;1011900;4;Darbai;Darbai;45420000-7;"Rinkiminių apylinkių įrengimas,inventoriaus remontas,surinkimas,išrinkimas";188710061;;1;N;N;N;N;"Mažos vertės pirkimai";I;Patvirtinta;;;;;
2023;ŠAS2023;1021070;28;Paslaugos;713;71319000-7;"Mokslo paskirties pastato, Miglos g. 1A, Vilniuje, techninio projekto bendrosios projekto ekspertizės paslaugos";188710061;;1;Y;Y;N;N;"Atviras konkursas";III;Patvirtinta;;;;;
2023;1;10106000;32;Prekės;392;39221140-0;"Gertuvės su Vilniaus ženklu";188710061;;1;N;N;N;N;"Mažos vertės pirkimai";II;Patvirtinta;;;;;
2023;INF-2023;1020960;40;Darbai;Darbai;45233252-0;"Lazdynėlių g. nuo Erfurto g. iki Lietaus g. rekonstravimas";188710061;"2023 m. Infrastruktūros skyriaus pirkimų planas";2;Y;N;Y;N;"Atviras konkursas (supaprastintas pirkimas)";III;Patvirtinta;;;;;
2023;INF-2023;1020960;27;Darbai;Darbai;45233252-0;"Ozo g., Ukmergės g. ir Siesikų g. rekonstravimas";188710061;"2023 m. Infrastruktūros skyriaus pirkimų planas";2;Y;N;Y;N;"Atviras konkursas";II;Patvirtinta;;;;;
2023;JS;1020970;6;Paslaugos;712;71220000-6;"Kultūros paskirties pastato, Konstitucijos pr. 25, Jaunimo nevyriausybinių organizacijų bendradarbiavimo erdvės projektavimo pirkimas su ekspertize ir statybos leidimu";188710061;;2;N;N;N;N;"Atviras konkursas (supaprastintas pirkimas)";I;Patvirtinta;;;;;
2023;1;1010203;14;Paslaugos;712;71240000-2;"Kultūros paskirties pastato, adresu Garsioji g. 3, Vilniuje, architektūrinio atviro projekto konkursas"".ekspertų ir recenzentų paslaugos";188710061;"2023 m. pirkimų planas";1;N;N;N;N;"Mažos vertės pirkimai";III;Patvirtinta;;;;;
2023;1;10106000;92;Prekės;183;18330000-1;"Marškinėliai su Neakivaizdinio Vilniaus vizualu";188710061;;1;N;N;N;N;"Mažos vertės pirkimai";II;Patvirtinta;;;;;
2023;AP-23;10200;69;Darbai;Darbai;45317000-2;"Pastato fasado papuošimo darbai";188710061;;1;N;N;N;N;"Mažos vertės pirkimai";IV;Patvirtinta;;;;;
2023;SEN13-2023;1012000;1;Darbai;Darbai;45420000-7;"Rinkiminių apylinkių inventoriaus montavimo ir remonto darbai";188710061;;1;N;N;N;N;"Mažos vertės pirkimai";I;Patvirtinta;;;;;
2023;"MTAAS 23";1021020;12;Paslaugos;983;98371111-5;"Kapinių aprūpinimas vandeniu ir šienavimas tarp kapaviečių";188710061;;2;Y;N;Y;N;"Atviras konkursas";I;Patvirtinta;;;;;
2023;AP-23;10200;16;Prekės;391;39110000-6;"Lankytojų ir biuro kėdės";188710061;;1;N;N;N;N;"Atviras konkursas";I;Patvirtinta;;;;;
2023;ITG2023;1021130;34;Prekės;488;48820000-2;"Tarnybinės stotys";188710061;;1;N;N;N;N;"Mažos vertės pirkimai";III;Patvirtinta;;;;;
2023;1;1010203;13;Paslaugos;714;71420000-8;"Žemės sklypo Garsioji g. 3, Vilniuje, kadastro Nr. 0101/0075:195, ir greta esančios teritorijos kraštovaizdžio objektų vertinimas";188710061;"2023 m. pirkimų planas";1;N;N;N;N;"Mažos vertės pirkimai";I;Patvirtinta;;;;;
2023;AP-23;10200;5;Paslaugos;553;55320000-9;"Maisto tiekimas";188710061;;1;N;N;Y;N;"Atviras konkursas (supaprastintas pirkimas)";I;Patvirtinta;;;;;
2023;AP-23;10200;36;Paslaugos;501;50112300-6;"Automobilių plovimo paslauga";188710061;;1;N;N;N;N;"Mažos vertės pirkimai";I;Patvirtinta;;;;;
2023;1;10106000;6;Prekės;223;22312000-0;"Paveikslai su Vilniaus vaizdais";188710061;;1;N;N;N;N;"Mažos vertės pirkimai";I;Patvirtinta;;;;;
2023;1;1010203;11;Paslaugos;713;71351913-6;"Žemės sklypo Garsioji g. 3, Vilniuje, kadastro Nr. 0101/0075:195, ir greta esančios teritorijos inžinerinių geologinių tyrinėjimų paslaugų pirkimas";188710061;"2023 m. pirkimų planas";1;N;N;N;N;"Mažos vertės pirkimai";I;Patvirtinta;;;;;
2023;"EOS 23";1017100;4;Paslaugos;722;72242000-3;"Techninių projektų ir schemų projektavimas";188710061;;1;N;N;Y;N;"Atviras konkursas";II;Patvirtinta;;;;;
2023;SIS2023;1090100;27;Paslaugos;909;90910000-9;"Valymo paslaugos";188710061;"2023 metų pirkimų planas";1;N;Y;Y;N;"Atviras konkursas";II;Patvirtinta;;;;;
2023;SEN1;1011400;2;Darbai;Darbai;45420000-7;"Stalių ir dailidžių montavimo darbai.";188710061;;1;N;N;N;N;"Mažos vertės pirkimai";I;Patvirtinta;;;;;
2023;ŽS2023;1012800;1;Paslaugos;923;92300000-4;"Pramoginės paslaugos.";188710061;;1;N;N;N;N;"Mažos vertės pirkimai";IV;Patvirtinta;;;;;
2023;S18-2023;1012400;8;Paslaugos;799;79952000-2;"Verkių seniūnijos renginių organizavimas";188710061;;1;N;N;N;N;"Mažos vertės pirkimai";II;Patvirtinta;;;;;
2023;AP-23;10200;109;Darbai;Darbai;45431000-7;"Plytelių klojimo darbai";188710061;;1;N;N;N;N;"Mažos vertės pirkimai";II;Patvirtinta;;;;;
2023;1;10106000;38;Paslaugos;793;79341000-6;"Projekto „Neakivaizdinis Vilnius“ reklamos paslaugos";188710061;;1;N;N;N;N;"Atviras konkursas";I;Patvirtinta;;;;;
2023;SIS2023;1090100;25;Paslaugos;503;50340000-0;"Vaizdo kamerų ir praėjimo kontrolės sistemos priežiūros ir remonto paslaugos";188710061;"2023 metų pirkimų planas";1;N;N;N;N;"Mažos vertės pirkimai";II;Patvirtinta;;;;;
2023;INF-2023;1020960;21;Darbai;Darbai;45233252-0;"Vilniaus miesto susisiekimo komunikacijų statyba, rekonstrukcija ir kapitalinis remontas";188710061;"2023 m. Infrastruktūros skyriaus pirkimų planas";3;Y;N;Y;N;"Atviras konkursas";I;Patvirtinta;;;;;
2023;AP-23;10200;32;Paslaugos;504;50411000-9;"Alkotesterio patikra";188710061;;1;N;N;N;N;"Atviras konkursas (supaprastintas pirkimas)";I;Patvirtinta;;;;;
2023;ITG2023;1021130;41;Prekės;482;48218000-9;"PhpStorm licencijos";188710061;;1;N;N;N;N;"Mažos vertės pirkimai";II;Patvirtinta;;;;;
2023;"EOS 23";1017100;9;Darbai;Darbai;45223110-0;"Santvarinių konstrukcijų, aukščio ribotuvų  įrengimas";188710061;;3;Y;N;Y;N;"Atviras konkursas (supaprastintas pirkimas)";III;Patvirtinta;;;;;
2023;JS;1020970;9;Prekės;185;18530000-3;"Dovanos partneriams ir renginių dalyviams";188710061;;1;N;N;N;N;"Mažos vertės pirkimai";II;Patvirtinta;;;;;
2023;NV-2023;1011600;5;Darbai;Darbai;45420000-7;"Rinkimų apylinkių paruošimo darbai (mažos vertės pirkimas).";188710061;;1;N;N;N;N;"Mažos vertės pirkimai";I;Patvirtinta;;;;;
2023;AP-23;10200;45;Prekės;301;30192000-1;"Buitinės prekės";188710061;;1;N;Y;Y;N;"Atviras konkursas";II;Patvirtinta;;;;;
2023;SIS2023;1090100;11;Prekės;301;30199230-1;Vokai;188710061;"2023 metų pirkimų planas";1;N;Y;Y;N;"Atviras konkursas";II;Patvirtinta;;;;;
2023;1;10106000;83;Paslaugos;925;92500000-6;"Vilniaus miesto pristatymo Vilniaus knygų mugėje 2024 organizavimo paslaugos";188710061;;1;N;N;N;N;"Mažos vertės pirkimai";IV;Patvirtinta;;;;;
2023;ITG2023;1021130;11;Paslaugos;722;72253200-5;"Vartotojų elgsenos analizės (UEBA) įrankis";188710061;;1;N;N;N;N;"Mažos vertės pirkimai";II;Patvirtinta;;;;;
2023;"ES 23";1020930;12;Paslaugos;507;50700000-2;"Inžinerinių sistemų ir statinių techninės priežiūros ir remonto paslaugos Vilniaus miesto ikimokyklinio ugdymo įstaigose (darželiuose) bei švietimo įstaigose (mokyklose) C zona";188710061;;3;N;N;Y;N;"Atviras konkursas";III;Patvirtinta;;;;;
2023;CMS23;1070100;8;Darbai;454;45453000-7;" Fasadinių lauko laiptų remontas";188710061;;1;N;N;N;N;"Mažos vertės pirkimai";II;Patvirtinta;;;;;
2023;INF-2023;1020960;14;Paslaugos;713;71354300-7;"Projekto „Dviračių takų infrastruktūros atnaujinimas ir plėtra Algirdo, V. Mykolaičio-Putino, Geležinkelio, Dariaus ir Girėno g. pietinėje tikslinėje teritorijoje“ sutvarkytos teritorijos atestuoto matininko matavimo duomenys";188710061;"2023 m. Infrastruktūros skyriaus pirkimų planas";1;N;N;N;N;"Mažos vertės pirkimai";I;Patvirtinta;;;;;
2023;SIS2023;1090100;6;Prekės;301;30197620-8;"Biuro popierius";188710061;"2023 metų pirkimų planas";1;N;Y;Y;N;"Atviras konkursas";I;Patvirtinta;;;;;
2023;SEN1-2023;1010800;2;Darbai;Darbai;45236290-9;"Antakalnio seniūnijos bendro naudojimo poilsio zonų remontas ir atnaujinimas";188710061;;1;N;N;N;N;"Mažos vertės pirkimai";II;Patvirtinta;;;;;
2023;AP-23;10200;90;Prekės;185;18530000-3;"Reprezentatyvaus dekoravimo atributika";188710061;;1;N;N;N;N;"Atviras konkursas";I;Patvirtinta;;;;;
2023;SIS2023;1090100;3;Prekės;302;30213000-5;-;188710061;"2023 metų pirkimų planas";1;N;Y;Y;N;"Atviras konkursas";II;Patvirtinta;;;;;
2023;ŠAS2023;1021070;3;Prekės;185;18530000-3;"Dovanos ir apdovanojimai bendrojo bendrojo ugdymo įstaigoms";188710061;;1;Y;N;N;N;"Mažos vertės pirkimai";I;Patvirtinta;;;;;
2023;1;10106000;85;Paslaugos;925;92500000-6;"Parodinio ploto nuoma Vilniaus knygų mugėje 2024";188710061;;1;N;N;N;N;"Mažos vertės pirkimai";IV;Patvirtinta;;;;;
2023;ITG2023;1021130;31;Prekės;480;48000000-8;"Pažeidžiamumų skenavimo programinė įranga";188710061;;1;N;N;N;N;"Mažos vertės pirkimai";IV;Patvirtinta;;;;;
2023;AP-23;10200;7;Prekės;445;44510000-8;-;188710061;;1;N;N;N;N;"Mažos vertės pirkimai";I;Patvirtinta;;;;;
2023;1;1011800;1;Paslaugos;923;92300000-4;"Pašilaičių seniūnijos gimtadienio šventė";188710061;"Pašilaičių seniūnijos 2023 m. pirkimų planas";1;N;N;N;N;"Mažos vertės pirkimai";III;Patvirtinta;;;;;
2023;RKS2023;1400300;7;Paslaugos;793;79341000-6;"Informacijos apie Vilniaus miesto savivaldybės veiklą viešinimas socialiniuose tinkluose";188710061;"2023 metų pirkimų planas";1;N;N;N;N;"Mažos vertės pirkimai";II;Patvirtinta;;;;;
2023;ITG2023;1021130;13;Prekės;302;30213200-7;"Planšetiniai kompiuteriai";188710061;;1;N;N;N;N;"Atviras konkursas (supaprastintas pirkimas)";III;Patvirtinta;;;;;
2023;1;10106000;48;Paslaugos;794;79416000-3;"Projektų ir iniciatyvų viešinimo paslaugos";188710061;;1;N;N;N;N;"Atviras konkursas";II;Patvirtinta;;;;;
2023;1;10106000;66;Paslaugos;923;92310000-7;"Kūrybinio turinio pažintiniams maršrutams viešajame transporte sukūrimo paslaugos";188710061;;1;N;N;N;N;"Mažos vertės pirkimai";I;Patvirtinta;;;;;
2023;1;10106000;94;Prekės;185;18530000-3;"Vilniaus suvenyrai vaikams";188710061;;1;N;N;N;N;"Mažos vertės pirkimai";II;Patvirtinta;;;;;
2023;RKS2023;1400300;13;Paslaugos;798;79810000-5;"Veiklos ataskaitos už 2023 m. bukletų spausdinimo paslaugos";188710061;"2023 metų pirkimų planas";1;N;N;N;N;"Atviras konkursas (supaprastintas pirkimas)";IV;Patvirtinta;;;;;
